{
  "metadata": {
    "schemaVersion": "1.0.0",
    "batchId": "9254cbc3-5eda-47f1-8dd1-359f3968ad0f",
    "timestamp": "2026-03-10T15:39:39.517215300Z",
    "totalGames": 2,
    "completedGames": 2,
    "format": "commander",
    "podSize": 3,
    "engineVersion": "forge-2.0.12-SNAPSHOT",
    "masterSeed": null,
    "threads": 1,
    "elapsedMs": 57166
  },
  "decks": [
    {
      "seatIndex": 0,
      "deckName": "Counterpunch",
      "commanderName": "Counterpunch",
      "deckFile": "Counterpunch",
      "colorIdentity": [],
      "cardCount": 100,
      "source": null,
      "sourceUrl": null,
      "archetype": null,
      "sampleSize": null,
      "importedAt": null
    },
    {
      "seatIndex": 1,
      "deckName": "Devour_for_Power_CMD",
      "commanderName": "Devour_for_Power_CMD",
      "deckFile": "Devour_for_Power_CMD",
      "colorIdentity": [],
      "cardCount": 100,
      "source": null,
      "sourceUrl": null,
      "archetype": null,
      "sampleSize": null,
      "importedAt": null
    },
    {
      "seatIndex": 2,
      "deckName": "Heavenly_Inferno_CMD",
      "commanderName": "Heavenly_Inferno_CMD",
      "deckFile": "Heavenly_Inferno_CMD",
      "colorIdentity": [],
      "cardCount": 100,
      "source": null,
      "sourceUrl": null,
      "archetype": null,
      "sampleSize": null,
      "importedAt": null
    }
  ],
  "games": [
    {
      "gameIndex": 0,
      "winningSeat": 2,
      "totalTurns": 12,
      "winCondition": "combat_damage",
      "gameSeed": 2092347827200,
      "elapsedMs": 8460,
      "playerResults": [
        {
          "seatIndex": 0,
          "finalLife": 0,
          "mulligans": 1,
          "isWinner": false,
          "commanderDamageDealt": 0,
          "commanderCasts": 0,
          "landsPlayed": 0,
          "spellsCast": 0,
          "creaturesDestroyed": 0,
          "cardStats": []
        },
        {
          "seatIndex": 1,
          "finalLife": 0,
          "mulligans": 1,
          "isWinner": false,
          "commanderDamageDealt": 0,
          "commanderCasts": 0,
          "landsPlayed": 0,
          "spellsCast": 0,
          "creaturesDestroyed": 0,
          "cardStats": [
            {
              "cardName": "a card",
              "drawn": true,
              "turnDrawn": 20,
              "inOpeningHand": false,
              "keptInOpeningHand": false,
              "cast": false,
              "turnCast": -1,
              "stuckInHand": true,
              "onBattlefieldAtEnd": false,
              "damageDealt": 0,
              "manaProduced": 0,
              "tokensCreated": 0
            }
          ]
        },
        {
          "seatIndex": 2,
          "finalLife": 40,
          "mulligans": 1,
          "isWinner": true,
          "commanderDamageDealt": 0,
          "commanderCasts": 0,
          "landsPlayed": 0,
          "spellsCast": 0,
          "creaturesDestroyed": 0,
          "cardStats": []
        }
      ]
    },
    {
      "gameIndex": 1,
      "winningSeat": 2,
      "totalTurns": 19,
      "winCondition": "combat_damage",
      "gameSeed": 2111388297800,
      "elapsedMs": 27186,
      "playerResults": [
        {
          "seatIndex": 0,
          "finalLife": 0,
          "mulligans": 4,
          "isWinner": false,
          "commanderDamageDealt": 0,
          "commanderCasts": 0,
          "landsPlayed": 0,
          "spellsCast": 0,
          "creaturesDestroyed": 0,
          "cardStats": []
        },
        {
          "seatIndex": 1,
          "finalLife": 0,
          "mulligans": 1,
          "isWinner": false,
          "commanderDamageDealt": 0,
          "commanderCasts": 0,
          "landsPlayed": 0,
          "spellsCast": 0,
          "creaturesDestroyed": 0,
          "cardStats": []
        },
        {
          "seatIndex": 2,
          "finalLife": 40,
          "mulligans": 2,
          "isWinner": true,
          "commanderDamageDealt": 0,
          "commanderCasts": 0,
          "landsPlayed": 0,
          "spellsCast": 0,
          "creaturesDestroyed": 0,
          "cardStats": [
            {
              "cardName": "zero cards",
              "drawn": true,
              "turnDrawn": 34,
              "inOpeningHand": false,
              "keptInOpeningHand": false,
              "cast": false,
              "turnCast": -1,
              "stuckInHand": true,
              "onBattlefieldAtEnd": false,
              "damageDealt": 0,
              "manaProduced": 0,
              "tokensCreated": 0
            }
          ]
        }
      ]
    }
  ],
  "summary": {
    "perDeck": [
      {
        "seatIndex": 0,
        "deckName": "Counterpunch",
        "wins": 0,
        "losses": 2,
        "draws": 0,
        "winRate": 0.0,
        "avgTurnsToWin": null,
        "avgMulligans": 2.5,
        "avgFinalLife": 0.0,
        "winConditionBreakdown": {
          "combat_damage": 0,
          "commander_damage": 0,
          "combo_alt_win": 0,
          "life_drain": 0,
          "mill": 0,
          "concession": 0,
          "timeout": 0,
          "unknown": 0
        }
      },
      {
        "seatIndex": 1,
        "deckName": "Devour_for_Power_CMD",
        "wins": 0,
        "losses": 2,
        "draws": 0,
        "winRate": 0.0,
        "avgTurnsToWin": null,
        "avgMulligans": 1.0,
        "avgFinalLife": 0.0,
        "winConditionBreakdown": {
          "combat_damage": 0,
          "commander_damage": 0,
          "combo_alt_win": 0,
          "life_drain": 0,
          "mill": 0,
          "concession": 0,
          "timeout": 0,
          "unknown": 0
        }
      },
      {
        "seatIndex": 2,
        "deckName": "Heavenly_Inferno_CMD",
        "wins": 2,
        "losses": 0,
        "draws": 0,
        "winRate": 1.0,
        "avgTurnsToWin": 15.5,
        "avgMulligans": 1.5,
        "avgFinalLife": 40.0,
        "winConditionBreakdown": {
          "combat_damage": 2,
          "commander_damage": 0,
          "combo_alt_win": 0,
          "life_drain": 0,
          "mill": 0,
          "concession": 0,
          "timeout": 0,
          "unknown": 0
        }
      }
    ],
    "avgGameTurns": 15.5,
    "avgGameTimeMs": 17823.0,
    "simsPerSecond": 0.03498583073855089
  }
}